date,country,rating,verification,cleaned_reviews
2022-01-09,United Kingdom,6,verified,flown many year today another poor experience witnessed airline decline sub par service understand tough two year airline decline started pandemic truly plummeted enormous queue jfk check terminal even priority lane standstill least half hour people started complaining miss flight terrible efficiency check counter time one member staff processing people whilst staff stood around phone chat one member staff stopped processing man desperately trying catch flight order start processing someone else jumped interior plane generally filthy crumb bit food stain mark around seating area give single wet wipe used think hand see passenger wiping surrounding area good courteous member staff also awful member staff behave unprofessionally particular flight one cabin crew swearing colleague back plane apparently pulling weight poor used proud flyer feel like clinging airline status actually provide better service day
2022-01-09,United States,10,verified,entertainment selection sub par minimal selection new release new release food left something desired two seat row earphone jack work plane either uncomfortably hot cold find medium temp overall basic generic airline
2022-01-07,United Arab Emirates,1,verified,straightforward friendly baggage drop south lounge polite conversation used lounge indication busy nowhere sit considering even distancing roam entire lounge lugging bag carpeted floor success gave minute decided try another lounge arrived everything actually right front actually found somewhere sit minute looking around menu basic egg hash brown breakfast cake muffin ordered frittata hungry made way self serve coffee counter basic coffee straight away put fly hovering croissant fruit flight departing gate take train rub salt wound told dxb flight usually leaf gone lounge near looking individual cubicle honest top reason choosing business class gave heart however door cannot close till take asked artisan crisp biscuit menu took hour lunch came another almost hour asked could swap pudding crumble person said surely try clearly apology even trying portion small plus saw quite fellow passenger sleeping lunch asked could finished chocolate lindor nothing special amenity toilet different expect amenity kit basic duvet seemed well used worth almost time amount regular ticket naive trust claim world class standard
2022-01-06,United Kingdom,3,not verified,verified arrival warsaw airport check zone one announced flight board guess ask random people finally found check desk luggage drop check appalling took hour get bag checked half way queue whole process disorganised slow really last thing want looking small impatient kid lady warsaw airport supposed direct passenger correct queue useless one check desk euro traveller club europe one bag drop one check flight left delayed pilot managed catch landed small delay crew plane nice attentive luckily air experience much better sort ground service warsaw airport
2022-01-06,United Kingdom,1,verified,glasgow one check desk open huge queue business check took close hour bagdrop getting onto aircraft glasgow hello crew getting normally find cabin crew nice breakfast tired looking croissant used lounge terminal keen new table service poor choice miniscule portion lounge staff nice direction arrival lhr coach transfer packed like sardine much social distancing flight lhr pisa delayed boarded sat aircraft another hr min captain advised tow truck push back eventually arrive baggage handler load container drink anything offered waited food even worth mentioning far club europe go worth extra cost priority baggage mine last onto belt pisa seat economy seat centre one blocked first officer summed arrived pisa sorry folk trip pretty poor show right return trip hogmanay left time never flight pisa left time pisa lounge nice enough food choice laughable board gave food miss heathrow back glasgow flight left time food antipasto sort declined case last club europe really worth money economy cabin would thought would food onboard service since cabin
2022-01-02,United Kingdom,1,verified,two year unable fly second home south africa covid fantastic back board flight cpt club suite seat boot seat huge improvement old yin yang seat term privacy ease access ife screen cabin still felt densely occupied seat uncomfortable lying flat storage mixed blessing three rather fussy little compartment rather decent sized drawer old meaning laptop would stored food onboard woeful although serving three course time least mean dinner service dragged cabin crew went business dutifully little enthusiasm usual queue toilet flight uneventful landing le time cpt efficient arrangement checking form immediately leaving airbridge queue immigration good back
2021-12-30,United States,3,verified,paid round trip flight london back premium economy bumped seat flight back told issued refund instead issued refund contact several different method phone website twitter finally email told getting back le half paid upgrade instead refunded emailed told getting back emailed saying add original amount told getting simply replied final amount turn meant taking back initial refund getting total emailed asking changed amount yet respond called morning explaining politely calling hung
2021-12-29,United Kingdom,3,verified,nice return flight add previous review really like organises boarding disembarking process group super comfortable passenger jump sweat queue gate even new cabin fresh feeling nice mood lighting row enhanced legroom thus make hour hop comfortable amazing staff even attentive accommodating gold level passenger always coming asking help needed lovely humus beetroot quinoa salad food great wifi really competitive pricing think great also food alcohol offered buy online travel class domestic arrival breeze
2021-12-28,United Kingdom,7,verified,overall lovely flight edinburgh christmas holiday lounge quite worn although staff food nice much better travelled last time although plane seemed old cabin felt fresh clean temperature perfectly adjusted liking around funky lighting although seat economy pretty comfortable hour hop much better air france together enhanced legroom row wonderful gold card passenger automatically reserve row club europe enhanced legroom think great touch crew especially purser phenomenal extremely friendly adaptive need professional leaving pleasant flight aftertaste afternoon tea catering lovely short flight sandwich scone tasty actually fan well presented however simpler meal board opinion tastier give feeling trust quick hop ticked mark comparison cdg lhr leg air france presented chic cold starter however looked bit complicated except duck terrine rather unappetising klm served super nice simple chicken caesar paper box one big drawback first wing experience queue long decided regular line instead quite disappointing given much money regular flyer company spend earn gold status nevertheless flight importantly crew completely negated drawback flight one way return incl transfer kirkwall pretty expensive however service seemed like worth money
2021-12-27,United Kingdom,1,not verified,verified first one smoothest flight taken boarding appalling family kid queue reason called family front decided board business premier class first appreciate call family worse seat ever legroom appalling entertainment system basic support bluetooth headphone usb support device movie although website say yes headphone input good useless crew nice sorry missed
2021-12-27,United Kingdom,9,verified,flying covid always challenge verifly app worked perfectly line check seamless bag drop seamless boarding done efficiently zone although older refurbished everything new clean cabin crew credit airline smartly dressed friendly keen please offered two drink lunch served drink meal food acceptable given tasty sandwich landing obviously economy hour flying arrived relaxed unstressed
2021-12-24,United Kingdom,9,verified,flew nashville via chicago first excellent check security lounge good food drink choice good first cabin seat comfortable seat entertainment little clunky cabin service top banana food drink choice taste amazing aircraft special call stewart tim credit
2021-12-23,United Arab Emirates,3,verified,low expectation business class european route flight even worse mess minute queue check bag ton people arriving late check guy seemed clueless turkey need pcr etc lounge joke went got sushi restaurant mulled wine crowded lounge bad round boarding chaos left hour late jammed full business class little legroom middle seat free might well fly low cost carrier seat inflight screen overhead screen although curtain closed economy people used forward bathroom crew sending back salvation pretty decent shepherd pie red wine otherwise would avoid flying next day flew aircraft type bahrain another carrier proper business class seat flight screen headphone good food drink arabic coffee date gracious service hang head shame
2021-12-20,United Kingdom,9,verified,used new club world first time delighted new configuration privacy afforded much better flight entertainment storage brilliant unfortunately lethargic crew ever meal served basically disappeared wine warm even forgot offer wife drink lunch also pair used sock storage cabinet heathrow nightmare often happens minute early rewarded minute wait gate hour wait luggage absolutely shocking covid time
2021-12-19,United Kingdom,9,verified,flight yesterday due take soon reaching gate first passenger called pre boarding gate staff said aircraft given permission land aberdeen due poor weather airport information kept telling passenger gate hour half passenger learned flight cancelled via app join line customer service desk took two hour reach desk case reaching desk told automatically booked following morning flight offered overnight hotel meet need requested cancellation get bag back told cancel booking app could desk directed via gate collect bag meant via border reach baggage belt waited bag hour automatically stored bag following day flight staff rude dismissive customer complaint length time bag taking arrive like fault cancelling alternative flight offered next day
2021-12-16,United Kingdom,2,verified,first time flown business class aircraft hopefully last firstly check crew great friendly helpful manual check machine always much nicer complaint department food journey adequate choice starter desert choice main course business class seating alternate seat facing backwards centre seat either facing stranger aisle seat put screen claustrophobic bubble cannot see cannot see passenger slightly better wife would utterly awful shut space stranger nowhere put glass bottle water book glass within easy reach unless keep table business class seat tuck bag seat front take landing nowhere put bag everything overhead locker missing first row centre seat much storage space row get climb leg leg rest person aisle seat row travelling solo centre seat always case normally couple take aisle centre least climbing partner leg stranger could manage wife could get without disturbing passenger row behind reading light hopeless shine book light controlled handset work utterly awful design certainly make avoid future possible
2021-12-12,Switzerland,6,verified,claimed mile right trip beginning august took almost month reply surprise reject request without providing reason sent complaint per mail still get reply month still waiting answer furthermore many people wearing mask asked flight attendant allowing people wear mask said medical exception ordered drink replied needed pick business class customer service
2021-12-08,United Kingdom,1,verified,british airway taking reservation cancelling flight without giving reason plan needed cancelled flight nothing ease process offered absolutely explanation flight cancelled going travel may travel year
2021-12-06,United States,2,verified,flight booked january send email beginning december informing flight changed second flight moved next day making layover hour called told cancel kind answer mean still need fly going booking another airline closer day flying expensive big inconvenience even get apology cancel
2021-12-02,United Kingdom,3,verified,future travel voucher singapore london thought would perfect flight relocate home impression simple process call book onto route previously paid previously cancelled new date wrong first pay top flight significant amount equivalent around value original flight redemption ticket part cash part airmiles price increase fact flying peak time extra charge also meant overall paid face value online price time ticket flight well still keeping airline redeemed explained online price redemption price differ system work however taken refund would lost lot money administration fee desperate situation losing hundred pound matter cut loss booked flight least thought call centre agent previously explained working remotely manager supervision way escalate issue took card detail including full card number date cvc code explained flight ticket receipt payment extra bag would follow week later still ticket detail charge card booking reference nothing called confirm call centre agent reached apologised advised would escalate booking team took card detail waited another week sign booked onto flight thus began cycle increasingly frequent desperate call british airway repeatedly failed simple task booking flight spanning week friday monday flight sat tear another call centre agent promised get flight book extra bag next day around hour due fly finally got booking reference yet still failed charge add extra bag luckily noticed check detail managed add bag online whole experience stressful costly resulted spending hour day phone listening british airway hold music furthermore significant cutback ba inflight catering service due covid resulting smaller portion leaving quite hungry long flight though flown repeatedly problem past service gone significantly downhill
2021-11-29,United States,1,verified,extremely disappointed trip experience gold mvp miler alaska airline ticket travel wasnt linked alaska airline speaking alaska representative confirmed due lack effort british airway accomplishing task could look lack effort even though frustrating main issue ticketing flt connection process departed egypt morning connecting ticket hand arrived usa apparently alaska flt changed hour later flight completely different airline delta without notifying customer found trying security seattle said ticket valid alaska airline find issue explained british airway rebooked delta took min customer service delta sort mess frustrated
2021-11-27,United Kingdom,1,verified,british airway seems happy encourage spread covid took flight heathrow paris cdg november boarded bus remote gate bus driver insisted packing bus maximum possible load standing door telling customer squeeze right leaving terminal bus full result passenger bus packed tight maximum facial distancing cm second coach aircraft followed minute later customer shameful ground staff exercise control nothing check bus boarding process whilst flight okay serf underline seem happy disregard covid safety protocol airport environment contrast recent air france iberia flight ground staff much disciplined actually try control customer maybe underline laissez faire attitude covid prevails
2021-11-25,Australia,1,verified,refused early check told come back departure staff staff member inexperienced poor attitude taking lot time passenger
2021-11-25,United Kingdom,2,verified,check document scanned without problem flight delayed minute due crew member stuck airline fault replacement crew found boarding onto new neo went ahead club europe cabin row economy seat middle seat blocked tall fit however anyone taller might struggle limited leg room inflight service stop start affair nothing write home crew failed work team galley get extra drink even served cool coffee filter paper bottom cup landing disembarking went without hitch included bus ride terminal finest hour
2021-11-24,United Kingdom,4,verified,arrived south airport tenerife hour departure iberia opened check even full flight waiting usual check process post covid took place usual error paperwork slowing thing passing security fine iberia lounge person capacity serve drink simple selection cold food boarding done meter long bus ride plane parked gate sure plane new neo row club seating seat hour flight anything longer would expect club europe leg room couple inch knee seat front food drink good served steel cutlery glass tumbler good selection wine average salad overall experience great cabin crew
2021-11-20,Sweden,1,not verified,verified check slow app check could check vaccine code online check staff friendly silver card holder stockholm lounge use boarding fine plane worn seat close together row even worse crew really professional happy seemed arrival heathrow total shamble landed gate waited waited minute jetty work step slow leave plane moderately mobile wheelchair passenger struggle step everyone patient supportive terrible watch skimping lounge plane condition gate crew good seat uncomfortable
2021-11-19,United Kingdom,6,verified,queuing check desk told booked seat available sell seat
2021-11-15,United Kingdom,8,not verified,verified outbound seated row told run chosen food option shepherd pie settle gnocchi steward temerity blame food supplier could get better one return boarding back priority seated row last half glass champagne one passenger row declined food rigatoni vegetable overall penny pinching club class dreadful
2021-11-15,United Kingdom,2,verified,flew club europe london tenerife south november returned november club europe seat comfortable pay lot exactly leg room middle seat empty spread tiny bit fare would hope least couple inch leg room would make huge difference least get meal outbound cottage pie inbound sausage mash bad drink service however inbound white wine apparently problem supplier pre book seat due extortionate fee pre booking airline charge pre booking seat premium class back flight new nearly near smooth timing issue good respect good check experience tenerife south tacked onto end large tui check queue also great lounge vip lounge merely adequate seating hour two would recommend still reservation exactly trying become
2021-11-14,United States,1,verified,hour standing line boarding pas airline would allow obtain boarding pas electronically said flight overbooked adult daughter got bumped flight yes used verifly flight delayed least minute unorganized slow getting seat advanced performed like airline wait even though paid avoid airline cost absolute worst
2021-11-13,United Kingdom,1,verified,trying get hold change return flight past week cant change online flying another city service unavailable online tried live chat several time waited hour told one available business hour tried calling line always drop end customer service non existent however course call new booking line someone immediately pick course however help put anyone apparently shambolic excuse airline deserve national airline problem flying throughout covid work unfortunately easier change flight domestic latin american airline even speak spanish
2021-11-13,United Kingdom,5,verified,whole experience sickening grand spent holiday customer service shamble drop menu drop menu stating wanted complain would even allow add tier point flight london marred problem london received upgrade email fast track vip lounge due amount spent never happened treated pauper wherever showed email change plane side airfield resort riu paradise beach riddled bad food drug bad attitude complained fobbed knew staff sound return journey shamble delay finally arriving back manchester completely exhausted needing another holiday light end horrid tunnel virgin atlantic started route month know better option
2021-11-10,Ireland,1,not verified,verified poorly mismanaged service time disappointed huge queue due unavailability attendant counter wait around hour check came boarding wait passage min finally thought thing better reaching london next boarding pas scanned around passenger including wait next flight boarding next flight space keep luggage journey really hectic expect
2021-11-07,United Kingdom,2,not verified,verified currently dreading flight considering hung mum customer service line twice reply via called live chat wanted find two flight booked mum name plus flight dad one wanted able make name change absolutely impossible website unusable customer service shamble change name told done booking carefully well going people making mistake maybe change website make change flight like hello century button saying change name anyways point woman phone started raising voice making clear gave towards end call said thanks help deal got cut minute got nothing say good luck
2021-11-06,United Kingdom,2,verified,another shuttle flight good one fantastic flying weather would say load factor good professional crew friendly complimentary snack arrived early worry getting gate make easy exit still cut competitor although bit expensive make total product delivery
2021-10-31,United Kingdom,4,verified,flight larnaca lhr check lounge aspire lounge shared basic flight left minute late made time route row business class cabin service quite expensive product offered long sector food great drink staff kept going lack glassware really interested honest paid lot money staff friendly responsive could club europe fine flight le three hour longer seat comfortable dreadful something think
2021-10-29,United Kingdom,2,verified,upon checking club desk lisbon airport passenger locator form found incorrect reference number day test check agent denied boarding causing wife recently spent long time hospital much distress job course requested call supervisor check manager goncalo ribeiro came rescue identify problem spent half hour time arranging new supplier day test uploading onto plf verifying flight documentation fast tracking check gate boarding wish comfortable journey could asked better service professional ambassador
2021-10-29,United Kingdom,10,verified,club europe british airway outstanding wonderful back welcome board warm sincere flight attendant helpful friendly professional great update flight deck super lunch good choice wine best hopefully excellence also reflection new ceo departure alex cruz
2021-10-25,Italy,6,not verified,verified good flight boarding chaos gifted beautiful gate lhr bussed plane first time used bus gate gate jetway nevertheless passenger full flight boarded via step caused hour waiting gate well baggage taking age also seat recline gatl broken
2021-10-24,United Kingdom,10,verified,usual economy trip pleasant crew complimentary snack water small bar service reasonable price fan new neo aircraft cramped seating uncomfortable armrest seat tiny thin short length offer little support two people enough one aisle width seems smaller going toilet back seems awkward done transatlantic aircraft another airline still offer good product good value priced time good value
2021-10-23,United Kingdom,9,verified,check easy security quick lounge fine lounge service returning pre pandemic day self service allowed great flight fine wife son felt breakfast like old style economy food perhaps agree nothing bad food nothing great either drink fine proactively served arrival efficient pcr testing needed fast turnaround baggage quick
2021-10-21,United Kingdom,7,not verified,verified happened british airway whole pre flight experience prehistoric appear gone back make passenger physically queue manually check adding hour journey mention ridiculous bunch people together big slow queue premise due covid precaution airline making passenger even open desk passenger two check staff like post office apart aircraft cabin crew literally everything else airline disintegrated point reliable enough use business purpose attitude towards exec club member loyal customer disgrace chosen insisted upon business personal travel decade accumulated lot air mile also one two amex companion voucher cost spending earn tell much supported airline despite shocking decline recent year last year booked flight personal business flight two colleague taking money wasting time planning itinerary cancelled forcing tear plan pay double last minute alternative airline personal one lucia cancelled return day flying forcing cancel holiday fly back immediately risk stuck week cost holiday offered nothing way compensation couple week ago noticed one amex companion voucher apparently going expire nov year tried speak world largely closed since march assumed would straightforward extend voucher time holiday destination properly open mention experience dealing routinely cancelled flight reluctance risk third person another holiday day going around circle speaking really bad english people empathy even live country finally got someone told extend voucher even shareholder level treatment disrespect spend another penny airline even going bother using second voucher cancelled amex work music business managing tour band reckon book flight year satisfaction knowing attitude cost roll inevitable administration least somebody else buy cheap start rebuilding world favourite airline ridiculed thought could ever make ryanair look like attractive option
2021-10-20,United Kingdom,8,verified,returned amazing holiday felt compelled write review flight generally torment nervous flyer however occasion absolute delight inward outward journey impressed professionalism friendliness kindness cabin crew economy treated respect service would expect first class cabin particular thanks must amir absolute joy credit british airway cannot wait fly huge thank much
