date,country,rating,verification,cleaned_reviews
2019-11-02,United Kingdom,10,verified,london belfast british airway bullied parent spoilt special occasion booked parent attend investiture palace mother heart attack month ago first flight post recovery chosen expecting best level service instead treated appallingly felt bullied airline staff mother suffers claustrophobia always request aisle seat booked parent aisle seat side side printed boarding pass seat arrival check one boarding pass recognised scanner assistance printed new one going security boarding pas recognised new pas printed parent arrived gate noticed one seat changed father explained situation rep check started quoting geneva convention contracted get could change seat wanted waiting gate try resolve situation eventually minute airborne rushed aircraft forced sit apart care welfare circumstance stage receive apologetic word someone recovering heart attack unnecessary stressful event spoilt special family occasion holding hope ba slide grace halt seem constantly disappointed await ba response parent know fly carrier handing back amex point appropriate apology issued update summary trust loved one care
2019-10-31,Canada,3,verified,london cape town booked business class ticket year advance trip africa usually fly star alliance picked segment better connection timing london cape town huge mistake tried reserve seat website twice able tried call twice gave hold hour time call back option arrived today london toronto connection desk seven hour flight told business class oversold would downgraded premium economy representative told reserved seat bottom list business class loyalty customer would priority seat would still welcome lounge bonus problem clear security get lounge since could print boarding pass due grade took close hour get settled lounge time first arrived connecting desk asked speak manager four interaction staff told would get speak giving impression trying pas unhappy customer fast could one point got visibly frustrated staff issuing new boarding pass indicated grade voluntary definitely two half hour customer service manager came speak first one actually apologetic tried address situation customer oriented perspective british airway think giving bulkhead seat premium economy basic lounge access paying business class passenger adequate customer service downgrade paid business fare upcoming overnight flight booking flight
2019-10-31,United States,9,verified,san jose london screen broken could locked position would allow watch movie flight attendant could fix suggested move different seat slipped purpose checked back seat front dirty tray moved hole right side screen sensitive enough operated touch although husband turned breakfast card together flight attendant insisted planning wake serve breakfast flight attendant best seems understaffed
2019-10-31,United Kingdom,1,verified,london heathrow edinburgh boarding efficient flight full passenger asked volunteer check hand luggage would get priority boarding took offer laptop carried plane aircraft two month old sat back plane sure ryanair room british airway aircraft offering ultra low cost service cloak legacy carrier legitimacy
2019-10-30,United Kingdom,10,verified,flight gatwick barbados check business lounge good look like added champagne self service drink positive breakfast good flight left time boarding well run flown economy cabin seems new configuration come panasonic ife system way better old rockwell collins system food fine service friendly
2019-10-30,Canada,1,verified,supposed flight bumped icelandair flight rebooked onto direct toronto london heathrow tried get changed supposed fly gatwick flight quite good service fantastic chicken tikka masala tasty crew onboard friendly flight time landing amazingly smooth
2019-10-29,United Kingdom,1,verified,travelling jeddah london bag arrive hour minute earlier check counter closed tried best staff help leave bag allowed take bag plane london made complaint saying thing get customer service phone call take hour minute wait
2019-10-29,Switzerland,5,not verified,verified zurich london return leg travelled hand luggage could choose seat without paying fair enough empty row either side stranger cramped one row allowed spread paid premium price seems mean say least hand luggage fare last board make uncomfortable board free food drink
2019-10-29,United Kingdom,4,verified,san francisco london efficient check friendly agent offered upgrade first per person declined refurbished lounge spacious comfortable nice selection snack boarding time could better controlled flight left landed ahead schedule flight attendant excellent food vastly improved compared last trip business class cheap excellent flight complaint
2019-10-27,United Kingdom,8,verified,london belfast check fast efficient using terminal first class check security area really good straight lounge great selection food drink early morning really like boarding process group number onboard service quality breakfast served excellent overall happy short flight
2019-10-27,United Kingdom,9,not verified,verified london gatwick salzburg british airway worst customer experience ever cancelled flight due strike action response week getting answer told fault would pay towards cost changing flight back home
2019-10-26,Germany,1,verified,frankfurt london flight attendant kind flying return flight canceled london city airport took almost three hour get rebooking hotel voucher transportation arranged could done far efficiently water nothing necessity
2019-10-25,India,3,verified,hyderabad san francisco via london awesome experience one customer service representative british airway called regard reimbursement put across lady named florencia helped gather detail bank address etc required payment also initiated payment instantly certainly beyond expected great job service exemplary
2019-10-25,Switzerland,10,verified,ancouver london poor experience flight business nice much crowded economical class one toilet closed nobody around repair one point even better asian company even freezing need freeze hour trip staff answer question staff make better one good point seat surprisingly comfortable easy make better
2019-10-25,United Kingdom,10,verified,london malaga terminally ill airline packed clueless staff full attitude checking gatwick airport told flight might well delayed departed yet malaga sm confirmed delay without new time departure provided link flight status gatwick arrival departure board prior security check flight time shown online asked guy lounge kiosk said could check link provided security monitor surprisingly flight time text sent update gate told aircraft replaced apology anyone neither ground flight boarded took stiff recliner seat cabin crew sociopathic full attitude additional seat replacing toilet located back located far end aircraft cabin crew storage room working space horrible low cost service flag carrier ticket price
2019-10-24,United Kingdom,1,verified,brussels london given seat number upon check left waiting outside gate boarding pass printed without explanation everyone else boarding pas boarding whilst looking operator thinking going extremely poor communication airline airport operator
2019-10-20,Australia,1,verified,flight london singapore premium economy worst experienced seat uncomfortable flight tracker failed two hour breakfast prior arrival singapore scrambled egg like rubber ran cup wife coffee tea drink breakfast used call button get attention one came answer call even waiting minute eventually made contact passing cabin crew member advised drink told would come back never saw crew member
2019-10-20,Argentina,10,verified,kuala lumpur glasgow via london service started first drink aisle female attendant young male attendant asked ale attendant pretended understand asking repeated many time word ale spanish accent still catch male attendant said like ipa answered yes changed beer offered amstel heineken chose amstel ask ice make drinkable service finished female attendant collected empty bottle can glass skipped meal chose beef asked beer male attendant realized empty still took food drink started eat ten minute obvious beer coming stopped another attendant going business class came back option tiger heineken lager female attendant offered coffee mention normal coffee menu said decaf available specifically request abreakfast offered tea coffee even decaf accepted milk cream
2019-10-20,United Kingdom,2,verified,london heathrow seychelles really great flight boarding quick flight full seat great good inflight entertainment plenty choice food good already pre ordered meal beef well done like late minute delay landed time seychelles crew attentive lot demanding passenger good flight hour
2019-10-19,United States,1,verified,edinburgh london heathrow problem flight crew service flying everything plane fine flight landed rushed baggage claim wife another flight london hour make even though could see plane watch baggage crew drive bag took minute bag came baggage claim service desk turned away furious customer manager could arrive time running catch next flight different airline missed turn next flight home next airline another day hoping british airway would help way went horrendous customer service desk agent basically told pound sand ended costing wife almost new ticket get home spent next hour airport british airway refused offer meal voucher never use airline
2019-10-16,Jordan,3,not verified,verified amman london nice aircraft comfortable seat soft landing aircraft fly amman airport local time arrives hour london good product
2019-10-16,United Kingdom,1,verified,london athens british airway glorified budget airline hour flight back athens food drink provided ask cup water charge ridiculous price inflated price sandwich meal entertainment option either usb charging seat well reputable airline flight length provides option yet charged full service airline price mismatch flew aegean route full meal drink provided
2019-10-16,United States,2,not verified,verified terrible lack leg body room economy easily cramped space ever flown travel lot flight hour leg cramp pain room modicum comfort little amount space economy cabin disgusting seat front reclines invariably even le room shameful food average well even bottom barrel budget airplane food never fly british airway star beware add nyc jfk london waiting area near enough seat requiring many stand sit floor call plane disorganized bedlam horrible excuse airline
2019-10-15,Argentina,10,verified,buenos aire london heathrow rwturn aircraft old cabin configuration old tired ife screen changed since first installed ipod larger responsive screen taking buenos aire pax offered water orange juice never got take drink offered followed hot meal food choice ran first row seat uncomfortable footrest jammed return flight sparkling wine water offered take followed drink meal chosen online beef stew mashed potato poor movie choice miniature screen uncomfortable seat crew indication toilet use either forward business class rear economy flown norwegian premium cabin route waste money
2019-10-13,Mexico,1,verified,mexico city barcelona via london heathrow incredible plane legroom quite good seat comfortable ife great number movie series music food average first meal meat mashed potato salad wine tasty breakfast scrambled egg mushroom fruit muffin delicious cabin crew bad excellent arrived time great flight second flight cabin crew appeared twice ife onboard service almost like low cost recommend long flight european flight
2019-10-12,United Kingdom,8,verified,great round october good price easy boarding lovely cabin crew great iced coffee sale comfortable time nice smile cabin flight crew windy landing ask reinstate free drink sandwich
2019-10-12,United Kingdom,5,verified,flew back abu dhabi world traveller plus seat uncomfortable warrant price tag seat seat cushioning terrible zero feeling comfort got sleep snack served take quite tasty breakfast dismal tasteless much interaction crew seemed friendly enough would travel british airway cabin really worth price tag
2019-10-11,United Kingdom,5,not verified,verified flew london heathrow abu dhabi honestly really good legroom great crew excellent looked superbly food drink bang vega april nowt wrong airline
2019-10-11,South Africa,1,verified,johannesburg amsterdam via london many delayed departure announced flight cancelled rescheduled depart following night following night announced delay due technical fault reported hour previously finally departed consequence missed connecting flight amsterdam also pay show hotel amsterdam trying claim charge declined offered pay taxi arrived amsterdam hour later really annoyed lack communication disorganized manner event mishandled board crew really nice getting new hope shattered terrible food board entertainment outdated connecting flight back home thing arrival delayed disembarking
2019-10-09,United Kingdom,2,verified,dubai london heathrow flew one first trip flying multi segment trip tried business class business class sadly old business class aging overnight trip new business suite offering best business class experienced gold card holder experience outstanding first lounge dxb good plenty seating good choice drink food choice lounge limited issue board new suite comfortable great night sleep closed door making difference getting full six hour bed comfortable food choice limited soup sandwich although suit timing flight would say excellent serious business product night time business traveller whether work leisure traveller want wow rather sleep daytime traveller know certainly could work effectively suite downside ife still rubbish relation rest product
2019-10-09,United States,8,verified,istanbul new york via london literally worst experience tried airline first definitely last time customer service hiring department scratch
2019-10-09,United Kingdom,9,verified,yesterday husband decided come home rome earlier scheduled time rang london customer service adviser helpful reassuring able change flight time without pay extra onboard flight steward gave hot water milk used preferred decaf tea charge waiting get plane wonderful conversation staff pleasant love flying continue booked flight next year thank taking good care sat much appreciate excellent service
2019-10-09,United Kingdom,4,verified,flight london athens british airway one worst experience new slim seat uncomfortable spend flight sadly next day well pain screen flight info gone frill airline become bad quality budget airline sad avoid
2019-10-08,United Kingdom,9,not verified,verified short minute flight north south british airway lounge lhr also ncl busy shortage seat gate departure arrival conveniently placed near airport exit seat flight comfortable schedule perfectly time
2019-10-08,Canada,2,not verified,verified calgary gothenburg via london british airway staff friendly helpful entertainment good food although salmon sandwich snack full plane first choice serve seat incredibly uncomfortable super narrow point sit arm crossed hit neighbour hour flight painful paid extra leg room good still one uncomfortable long flight ever recommend short trip
2019-10-07,Malaysia,10,verified,long time avoided taking british airway due poor past reputation yesterday traveled kuala lumpur london heathrow boarded flight open mind hour later disembarked feeling happy always good see airline make visible improvement deliver value customer praise due want congratulate pleasant experience flight departed time arrived half hour early crew professional everything smile made passenger feel welcomed plane pristine new delightful entertainment content food way expectation seasoned economy class traveler say enough say traveling
2019-10-06,United Kingdom,1,verified,austin london another pleasant flight ageing horror discovering one allocated centre seat meaning effectively sleeping next stranger kindly swapped seat could together couple centre seat really quite nice feel little world good flight time nice crew good expect
2019-10-06,United Kingdom,10,verified,london kuala lumpur better expecting reading review seat great service friendly leg le return area need improvement separate toilet economy dedicated crew premium economy section rather added onto economy service better meal main meal great noticeably premium however next meal breakfast bit afterthought would choose premium eco yes definitely
2019-10-03,United States,1,not verified,verified wish could give zero booked flight newark madrid via london come find minimum layover time london flight layover london min british airway promised arriving departing terminal london total lie wife sprinting across airport getting aeroplane security get side airport connection missed layover flight route reverse direction called hoping change return flight explained situation kept insisting since layover staggering minute london minimum layover threshold unable help way british airway far worst customer service ever experienced ryanair frill airline better customer service saying something never flying plan converting company away flight well warned stay away carrier cost prepared deal zero customer service case issue arise
2019-10-02,United Kingdom,8,not verified,verified one reason traveled club class lounge get away usual airport chaos screaming child tell lounge ko airport limited seating noisy limited facility sure spend much air ticket future warn limited facility help flight delayed hour
2019-10-02,United Kingdom,6,not verified,verified gatwick alicante outbound flight sept gave almost across board review invited complete return flight sept different matter entering alicante airport boarding service comparison standard except vip lounge good travelling club europe advantage one check open passenger bag drop facility facility print boarding pass invited board wait minute ramp let plane iberia factor honestly thought company plane everything went like clockwork
2019-10-01,United Kingdom,10,verified,ancouver london great flight superb opinion comfortable quiet aircraft flying moment outstanding flight service crew attentive polite professional best british airway service food well average cabin though breakfast could better ife excellent seat comfortable good recline supplied decent plump cushion excellent quilted blanket enjoyable flight highly recommended
2019-09-30,United Kingdom,8,verified,gatwick alicante hour hour sitting tarmac knee rammed seat front room move travelled several airline route last month vueling airline best seat stay away rest unless tall
2019-09-28,United Kingdom,7,not verified,verified torrid experience shy report flew yesterday heathrow austin great flight every way felt right feedback staff upstairs business class cabin frankly wonderful cheerful efficient calm could ask food pretty nice champagne lovely bed comfortable sleeping easy literally cannot think real negative luggage locker quite small older model plane probably explains could deliver kind experience every occasion would world favourite airline sadly current ceo seem able inspire motivate staff consistently delightful perhaps move expect something better although flight bit delayed departure arrives bang time entered literally empty immigration area met charming custom officer imagine ended giving tourist tip idea bar surreal anyone regularly travel state testify felt living truman show one point nicest possible way get good ole austin fly direct fantastic
2019-09-28,United Kingdom,1,verified,london heathrow austin british airway little bit like going back time fly upper deck austin enjoyable flight taken long time quiet deck fantastic flight crew enough always smile arrived fresh hour air time thoroughly enjoyed experience slight issue ife system small overhead locker plenty spare locker ipads took
2019-09-27,United Kingdom,5,not verified,verified actually fly pilot strike review poor service customer due fly day strike immediately tried rebook airline flew jersey course put air fare day question pay return flight cancelled flight refunded paid difference picking seat consider part cost flight refunded everything fault striking completed complaint form month ago never responded week ago phoned customer service line person spoke said would refund never received refund
2019-09-26,United Kingdom,4,verified,start journey back efl inauspicious hundred delayed stranded passenger crammed departure lounge awaiting flight airline weather plus air traffic control issue meant departure delayed minute airborne refitted complete nice fresh leather smell cabin crew friendly efficient food including cod dish quite reasonable interesting note refit extended toilet looking distinctly worse wear big plus flight first wifi actually worked quite fast although cost hour use thought meant free business class passenger evidently landing made time parked right middle nowhere backlog flight however laid separate bus passenger airport minute later bad
2019-09-26,Italy,9,not verified,verified chicago zurich via london delay delay flight supposed depart chicago time scheduled waited long time airport finally managed board first time legroom horrible ife completely unfunctional food served taxi technical problem occurred returned gate end plane took chicago time arrived london heathrow wait hour boarding another minute delayed flight arrived zurich old zurich time instead original stressful least staff nice
2019-09-23,Japan,1,verified,glasgow london smooth flight departure arrival time boarding quick seat although pre ordered vegetarian option caterer provided said flight attendant quickly solved issue food good wine french bourgogne also surprisingly good flight attendant professional polite attentive detail great flight
2019-09-21,United Kingdom,10,verified,booked flight week strike mistakingly thinking strike would ended two day flew fact day apprehensive would operate check security clearance took minute personally like self service bag tag drop operate one confident everything correctly boarding new fare group system depends much one paid ticket fan possibly due previous day strike need accommodate passenger canceled flight aircraft large boarding however smooth board virtually full cabin clean eurotraveller seat comfortable offer sufficient leg room knee touch seat front departure minute behind scheduled departure time flight cabin staff euro traveller cabin believe club cabin efficient friendly one wait minute take purchase refreshment full flight shame though gone frill line charge food drink describe full service airline landing tegel minute ahead schedule pleasant flight value good combined hotel booking tegel bit hassle border police carrying immigration control passenger end airbridge minute wait luggage fault
2019-09-19,United Kingdom,8,verified,even rate business class passenger booked via business bag lost transit ground crew mxp rude dismissive unhelpful unable locate missing bag waited next flight arrive still bag decided cut short trip bag contained essential med lesson learnt hard way due booking customer service unwilling flexible change ticket resulting full fare ticket purchased return apparently bag arrived hr later back despite website showing transit lhr mxp day numerous lengthy call customer service proved fruitless passed one department another cut email ceo director brand customer experience received call global engagement executive team offering voucher abysmal customer service wonder reputation tatter never fly
2019-09-19,United Kingdom,1,verified,flying london city geneva plus embraer jet comfortable interior plenty leg room economy seat offer basic frill service different budget airline yet charge full service price
2019-09-18,United States,7,verified,los angeles istanbul via london flight london istanbul like coach small leg room transatlantic business seat narrow mine become complete bed food average heathrow business lounge cramped tasteless dirty lounge took min find two chair seat food awful service even worst wanted change departure date day pay penalty plus fee change ended paying per person addition fare already paid
2019-09-17,United States,1,verified,phoenix tel aviv via london return london phoenix nightmare want everyone know sent complaint time one talk something used
2019-09-16,United Kingdom,9,not verified,verified london kefalonia gallery lounge showing age packed saturday boarding standard group meant waiting minute queue minute bridge flight deck informed waiting stand minute departure slot air cabin crew delivered usual club europe experience mediocre best fortunately arrival minute late kefalonia airport minute later overall typical experience lacklustre best
