date,country,rating,verification,cleaned_reviews
2023-02-07,United Kingdom,5,verified,boarding delayed due late arrival incoming flight communication ground staff excellent keep informed flight service excellent crew friendly excellent service overall happy
2023-02-06,Spain,9,verified,first flight year also first time back england year flew pmi lgw returned wizz air easyjet offered inconvenient flight time charged flight worth baggage british airway convenient best value option available offered ideal flight time charge per flight baggage reasonable total cost flight regular update information via email seamless online seat allocation check efficient staff check desk pmi lgw ensured long queue dealt quickly humanly possible immaculate aircraft comfortable leather seat adequate legroom tall cabin crew polite friendly professional flight food drink good quality reasonably priced enjoyed meat ploughman ipa beer total flight flown time last year different airline various propeller jet aircraft well one lgw lhr helicopter transfer flying totally different experience back day age budget airline nostalgia aside british airway best airline flown
2023-02-04,United Kingdom,10,verified,husband flying madrid february legal matter madrid booked flight car holiday unfortunately chose parking never used got lost missed flight madrid tried stay calm cold head went british airway get help first lady spoke asked done booking holiday know gave number call told anything else call number called number asking call another number message opening hour till went back lady explained wait told could anything reach another staff lovely young lady called althea started look made several call went check someone else office managed get someone send text message call got answered lovely lady line modified booking place following flight charge car reservation flight back maintained made madrid without support lovely althea professionalism care would make sweet caring time determined help sure went beyond role responsibility
2023-01-31,United Kingdom,10,verified,organised boarding process really friendly crew quick drink snack great experience crew credit best crew europe
2023-01-31,United Kingdom,10,verified,outward journey london buenos aire club world january experience poor beginning end although reserved seat another passenger occupying crew made attempt address problem eventually persuaded passenger move occupy designated seat boarded punctually offered drink asked drink crew member said late blamed seating problem crew member began taking order dinner write gave minute safety briefing asked repeat order later hot flannel smelled musty felt old ragged one crew wondered aloud whether companion related soup cold told served flask explanation excuse coffee weak tasted like instant granule companion initially served bread roll dinner breakfast menu stated selection roll pastry choice companion given dried fruit pastry would chosen bread roll although previously asked offered supplied seat small bottle water ran return journey buenos aire london heathrow world traveller plus january huge contrast warm welcome boarding crew professionalism throughout poor reflection club world service experience world traveller plus much better kinder weighed advantage flat bed considerable price difference worth paying catalogue error inconvenience outlined
2023-01-28,United Kingdom,2,verified,check agent lhr helpful friendly flight crew seat comfortable good leg room however food poor barely better economy class poor quality limited selection wine flight entertainment selection limited far inferior used offer overall premium economy product disappointing poor value money
2023-01-28,United Kingdom,4,verified,disappointing book fly day return flight cancelled replaced flight took hour late meaning arrived gatwick well midnight onward transport connection pay taxi home plus seat really snug knee hitting seat front trading name customer service reliability deteriorated ryanair better aircraft take slot
2023-01-24,United Kingdom,3,verified,excellent service ground board first class product might leading edge service around entire experience well worth cost ticket concorde room heathrow well managed great place relax prior trip flight slightly delayed heathrow arrived schedule johannesburg
2023-01-24,United Kingdom,9,verified,good lounge cape town time departure drink high quality sound dinner service breakfast reasonable arrival lounge good shower cold
2023-01-23,United Kingdom,9,verified,really excellent journey lounge overcrowded late afternoon plenty edible food easy boarding new club world suite great compared last travelled year ago food drink back previous standard choice individual wine rather bland blend course served individually cut glass china beef cheek really tasty surprisingly good soup crew excellent good choice movie breakfast good night sleep fruit etc first manage full english offered arrival time could want quite gulf standard overall seems eventually got business class back standa
2023-01-21,United Kingdom,9,verified,flight one worst ever life wanted pamper bought business class looking forward new experience mention chaos changing gate several time thing may happen surprised lack attention passenger flight delayed almost hour even though staff offered voucher idea get told minute use boarding already begun firstly see anyone voucher secondly even got able use finally got airport another waiting minute cross check meantime told due problem load food flight without food board food offered given everyone plane small bag nut business class passenger offered drink business class contained small glass juice received apology compensation company disgraceful cheap service expensive price
2023-01-19,United States,2,not verified,verified seems race bottom amongst airline cannot even check requires submission document covid restriction however form start submission process hopelessly broken clicking submit form hang forever error message given tried three different browser three different device hang mean cannot check online select seat tried using chat bot minute clicking try thought donated enough time
2023-01-19,United Kingdom,3,not verified,verified spanish born individual living england using british airway decade multiple time year january booked flight son alicante however informed january doctor unable fly due elbow operation result decided give ticket daughter calling customer service team british airway make change january took enquiry call seemed speech delay call presented small bit difficulty however also struggled understand support staff member top delay requesting change name one ticket daughter name told within policy would need cancel ticket rebook encouraged divide booking son two different booking reference number accepted asked would like cancel booking insisted would need know total refund lucky ask check informed would roughly total cost booking come per passenger leaving refund total le value purchase despite seat abandoned according policy entitled simple change name le refund even buying ticket right back phone probably money worth week ago
2023-01-18,United Kingdom,2,verified,rather empty quiet flight tel aviv friendly cabin crew due emptiness flight entire row allowed work easily much space required unfortunately upon landing break overheated wait fire crew cool delayed otherwise overall excellent flight part first time flown flight actually taken correct time
2023-01-17,United Kingdom,9,verified,easy check staff member polite helpful made specific point acknowledging loyalty security london fast gallery north fine shower good organised flight boarding plane fine good crew new club world product wife damaged storage area otherwise take good drink food service well run slept well time arrival found new seat design harder sleep
2023-01-17,United Kingdom,9,verified,silver flyer booking flight dublin would thought could use lounge even though used air lingus flight travelled recently situation allowed kind gentleman desk even though said gold really accommodating big deal two lady desk like empathy saying guy let word come booked flight made fly air lingus let use lounge silver flier
2023-01-16,United Kingdom,1,not verified,verified find incredibly tacky constantly looking way get money customer travelled using major airline whole life although know sound silly hour flight major airline expect form beverage snack curtesy port charge phone pay insane price luggage inflight entertainment aircraft snug challenged pay drink inflight entertainment told short haul fight sister met cairo hour half flight flew egyptair somehow received luggage allowance drink food inflight entertainment well usb port charge phone realise stand budget airline staff great got money much
2023-01-09,United Kingdom,3,verified,flew atl lhr jan unlucky enough board year old refit gave decent ife screen seat looked decent although combine ife cheap nasty earbuds movie ruined headrest great pity little padding used seat wife uncomfortable leg room general poor especially passenger keep seat reclined start finish zero room aircraft tired rubber spacers falling silicone sealer falling apart toilet toilet seat old stained rubber arm rest hanging post take drink snack offered meal sent couple hour poor chicken cube reminded dog food mashed potato purified within inch life stale rock hard roll salad rice carrot dried cracker cheese kid meal sad tiny leaf salad enough dressing refloat shipwreck coffee creamer given kid meal snack decent adult bagel cheese egg hot tasty kid snack green wrap spinach onion poor mix food service grunt crammed seat hour landing remote stand enduring bus terminal opinion terrible flight disappointing one great member cabin crew everything else average
2023-01-08,United Kingdom,4,not verified,verified great thing british airway economy section upstairs get allows small stowage cupboard window seat despite old looked tired inside broken side stowage seat reclined uncontrollably slow react ife food supposed christmas dinner wafer thin bit dry turkey cooked sprout cubed potato poor taste quality mousse desert great though slight issue snack meal ordered child option marked regular meal arrived well exactly asked crew member told difference sticker box staff couple decent mostly overall seems tad cheap day great sit upstairs enjoyment ended seemed bit dull like average airline
2023-01-06,Canada,5,not verified,verified staff friendly plane cold shivering gave light blanket enough meal basic entertainment basic luggage delayed today day staff phone say call hour tracking system vague extract information staff arrived vancouver jan offered collect baggage vague answer call airport asked phone number yvr said phone number call call main airport policy state make claim day
2023-01-02,United States,1,verified,probably worst business class experience ever airline issue required purchase seat international club world business class made known ticket purchase process cost additional single leg lhr lax family four given strange business class seating layout leaving seat selection change could disastrous family ridiculously long boarding time even small aircraft vie lhr leg boarding time minute long leading delayed departure urgency part staff speed boarding time severe overcrowding boarding area satellite terminal heathrow boarding staff would allow passenger enter roped queue area boarding idea crowding extreme overall boarding area far small believe satellite designed built first delivered online check advance flight appears completely broken urged repeatedly website via email text upload covid document even though end covid document required travel filled basic contact information website upload covid documentation informed several hour later covid document verified received another text message urging upload covid documentation vie lhr leg shop com page one directed attempting connect wifi plane indicated ridiculously incorrect remaining flight time six hour four hour landing lounge club europe club world heathrow often seriously overcrowded furniture carpeting finish club worn dirty said food lounge pretty good quality food quality lounge heathrow may redeeming thing airline onboard food beverage service far average international business class terrible one might say lhr lax leg pre meal beverage service mid flight beverage service unlike business class offering airline taking meal order flight attendant beginning flight meal brought haphazardly shortly take chicken fish type meal selection similar economy class coffee tea service meal food quality poor pre landing snack ploughman lunch downright disgusting beverage bar set galley area beverage available passenger flight standard international business class offering even bottle water seemed hidden away requiring one ask flight attendant water comment bizarre seating layout others rightly panned awkwardness extremely poor design seating seat long stated website found seat short height priority luggage tag followed baggage delivery
2023-01-02,United States,1,verified,definitely recommended especially business class seat ridiculous small food mediocre good luck internet even pay full internet entire flight service however great attendant saved cry know designed aircraft expensive business class order move middle seat bathroom must rudely climb person leg sitting aisle seat seat like enclosed tiny cubicle storage space unfortunately traveled british airway business class least time within last month never unless choice way business class lounge south heathrow cattle pen
2023-01-02,United Kingdom,2,verified,shuttle service across still surprisingly good product compared long haul always get best comment time reasonable priced work well fresh crew queue long distance walk know still offer covid style bottle water snack stretching cup tea snack would great add service currently line sky cafe fiddly work get connected short trip
2023-01-01,United Kingdom,8,verified,must admit like many others tend avoid long haul possible due many poor review first ride day exception say aircraft immaculate economy seat really comfortable ife work interesting anyway got map screenshot lunch poor quality plenty nice white wine alcoholic drink made cabin crew pleasant poor grooming let skirt trouser suit long sleeve short jacket waistcoat cardigan time could done better think baggage delivery really quick summing well still coming back yet maybe old charm return soon
2022-12-30,United Kingdom,6,not verified,verified update business class cabin across much travelling facing backwards cabin staff pas food tray across front passenger paying business class fare pay reserve specific seat antiquated idea cabin staff fine food acceptable check business lounge breakfast acceptable lack space seating area small screen disfunctional entertainment equipment disappointing step reclining passenger foot attractive
2022-12-29,United Kingdom,4,verified,paid day flight upgrade economy premium economy checkin could find booking little wait rang someone explains upgrade get deleted system checkin agent see took minute resolve seat nice enough stowage pocket front bit small food reasonably nice shame bathroom way back economy bit queue ife system good selection mediocre worst part flight cpt remote stand bussed passport control quickly took absolute age get luggage ruined would otherwise reasonable flight upgrade worth maybe long flight offer whatever premium economy comedy pricing score luggage fiasco would luggage fiasco rate
2022-12-29,United Kingdom,4,verified,website work weirdly deleted flight upcoming flight day departure chaos cape town airport hundred queuing computer chaos gate queue management premium passenger nice new smart new club suite champagne warm cabin crew said impossible serve cold true air france manage disappointing meal wine served late food finished time arrives cheese ice cold tasteless champagne white wine fridge used cheese good ife system mediocre film selection disappointing breakfast overall flew air france business month way better sad become
2022-12-29,United Kingdom,3,verified,absolutely terrible experience british airway short flight london heathrow frankfurt get suitcase time next flight cathay pacific melbourne despite hour gap two flight told would arrange suitcase transferred directly melbourne instead got hong kong left finally tracked sent back london happened christmas stressful yet minimal communication team plane crew may lovely service outside nothing short dreadful given option avoid flying future
2022-12-28,Canada,1,verified,ancouver delhi via london booked fly vancouver new delhi via london heathrow dec received email dec informing industrial action called find may impact travel representative kind scared possibly stranded travel offered full refund called confirm option offer solution asked cancel ticket told cancellation fee booked new ticket another airline double cost trip urgent simultaneously told longer cancel ticket system promised make happen told would get full refund processed cancellation hour later emailed ticket cancelled suggested cancel new ticket found another airline lost cancelling new ticket representative claimed never said service available asked worrying industrial action arrangement made issue new information never given kept british airway ticket next day asked speak manager report misguided whole situation never heard back manager logged check hour take found van lhr flight cancelled due bad weather vancouver receive email airport airline change called asked rearrangement flight offered rebooking additional per person price difference date offered day original flight supposed leave additionally cancel rest flight could reach since first flight cancelled pay cancellation fee get refund frustrated overall experience accommodation accountability wanted charge service change possible phone hour flight could booked getting sold customer service person would take minute real search question option asked frustrating experience lost time money ruined holiday completely demanded speak manager want take accountability team gave small discount cancellation fee total phone day back forth without resolution felt misguided misinformed unfair policy towards customer feel taken care pay price misinformation flight cancel trouble spent christmas without family missed urgent reason travelling
2022-12-24,France,1,verified,old narrow pitch flight perfectly time constant announcement cockpit friendly staff free chip water quick luggage delivery
2022-12-22,United Kingdom,8,verified,another shamble started well excellent check first mid afternoon avoided early morning evening scrum concorde lounge excellent service great choice cocktail wine etc food bit overcooked pretty reasonable called boarding gate chaos people jostling position get plane people child called people first bankrolling flight well get told none light first dimmed light night like detained interrogated excellent wine champagne selection dinner menu handed prawn cocktail start please loaded one people guy got bet felt like lottery beef wellington basically freezing slice beef lettuce main curry substituted christmas dinner going maldives get away christmas ended short rib inedible salad starter water offered bread roll eat basically husband spent return seat blinded light left starving apology watch virgin start flying direct october always rest laurel treat customer like idiot
2022-12-20,United Kingdom,3,not verified,verified cancelled flight home heathrow dec face sensible weather iceland appalling however acceptable flight cancelled hour take time time already struggling dreadful driving condition get airport got nowhere near condition became bad taken advice would spared everyone need try travel road ended closed booked onto flight downgraded sin checked today type cancelled flight despite road keflav closed check thing help offered really
2022-12-19,United Kingdom,1,not verified,verified cancelled flight home last flight day heathrow tried push onto another flight london city hour later car heathrow want try cross london late night public transport luggage especially rail strike announced around time book flight home lufthansa cost economy seat least got home heathrow another terminal friday night could get home family still news refund month shame flying used pleasurable experience cancelled moved one leg every journey booked year regrettably use airline much better reliability customer service
2022-12-19,United Kingdom,1,verified,urned hour advance terminal london heathrow already carnage people trying check desk manned long queue security due line open people stressed pushing shouting flight delayed hour according pilot delay due suitcase needing loaded missed connecting flight doha hour wait til next one received voucher approx whole day arrived day later suitcase arrive filed claim desk day update information offer compensation solution offer spoilt holiday many personal belonging gone xmas gift missing extensive expense know reimbursed beware expect low level zero customer service old plane zero help anything go wrong missing personally avoid future cost
2022-12-19,United Kingdom,2,not verified,verified boarding gate lgw called group board world traveller plus group called anyone group whereupon everyone else surged forward numbered boarding group use cabin crew treated passenger inconvenience moved plane one point passenger coming toilet crew member approached crew member pushed door closed pushing back toilet went past without even word acknowledgement stood aside let past service final row six total seat lunch meal brought last people served unusual back row seat came vegetarian option left menu option cabin steward said given meal second hot meal served landed server got last vegetarian option left asked might possible commence serving second meal back front choice least one meal said thought food inedible vegetarian cannelloni pasta thick uncooked neither could eat bread roll crispy like toast bottom half soft top half thing could eat baby bel meal snack consisted biscuit pack shortbread pretty basic drink ran red wine hour hour flight toilet toilet accessible directly section walk halfway plane economy reach shared toilet flew virgin atlantic month equivalent premium economy much better organised boarding sparkling wine orange boarding water orange food option available even last row seat better food proper glass cup drink dedicated toilet access help snack helpful service cabin crew looking fly virgin future
2022-12-17,United States,2,verified,missing baggage customer service worst ever experienced arrived back phoenix sunday evening air tag showed bag arrived monday took three day finally delivered understood due delay caused freezing fog london luggage make onto final flight filled required form phoenix airport attempted fill one online received message saying bag already reported missing enter tracking code sent via email email received made phone call daily told message sent hear back within hour finally email tracking number received tuesday night went online tracking number wednesday requested provide information given form airport luggage finally delivered thursday afternoon
2022-12-14,United Kingdom,5,verified,british airway flag carrier used check staff club europe area display premium service provide good overall service gallery south lounge busy food good good array salad pasta bread hot food available festive turkey ham pie particularly good flight delayed lhr busy tuesday evening boarding process stressful due lack queue management system majority passenger congregating around gate despite using group system board took almost board passenger flight good good club meal service bar service good seems done away champagne board also lounge menu handed prior departure good food offering length flight food good beef cheek served vegetable chosen always excelled catering changed seat standard economy seat table middle seat club europe standard practice seat comfortable limited leg room cabin clean presentable tidy issue featured contains good landing page flight information access speedbird cafe menu access com good pricing strategy wither messaging streaming also overall airline still good world player clear improvement needed ground staff cabin manager good crew club display expected behaviour business class kept touching face making eye contact passenger seemed uninterested like want
2022-12-12,United Kingdom,6,verified,stupidly tried five year gap paid wife barbados thought new business class layout might rival virgin atlantic route six month ago announced switching plane old antique push pull layout late reorganise holiday logistics sure enough suffered appallingly uncomfortable flight room eight seat across worn fitting inedible food surly fa
2022-12-12,New Zealand,1,not verified,verified seat horribly narrow thankfully flight quarter full able stretch food beverage service good great proper beer cup froth overflow cabin crew good booked ticket included travel qatar airway well
2022-12-10,United Kingdom,8,verified,glasgow london delayed hour wife accept flight late delayed rarely time long accept disappointed planning ahead high risk delay connecting another airline oneworld extremely risky
