date,country,rating,verification,cleaned_reviews
2019-01-07,United Kingdom,3,verified,london berlin scheduled december approach airport got message saying flight canceled explanation given arrived airport staff acted confused said rerouting center closed evening due issue wanted travel next day ahead christmas book travel another airline train company eurostar cost would reimbursed airport staff also said help british airway available day due airport issue felt way rebook different airline hefty gbp fare short haul flight next day christmas price high arrived destination lengthy exchange message british airway started british airway said end compensate cost rerouting different airline opposite airport staff said day cancellation
2019-01-05,United Kingdom,4,verified,london mumbai battle leadership would let book seat pay airmiles finally relented please many earn airmiles credit card illustrate boarded slightly negative mindset mindset changed quickly although travelled economy seat comfortable service excellent food minor quibble choice film seems reduced many quite old attempt reduce cost quite obvious detracts overall quality product particularly impressed trouble cabin staff took warn take single use plastic water bottle duty free carrier bag terminal could result stiff fine grumpy several aspect service past writing leadership thank improvement
2019-01-03,Greece,1,verified,athens los angeles via london worst flight experience ticket october travelling december hr decide cancel flight give alternative another flight hr later athens los angeles via london day arrive london realize announcement screen flight operated heard announcement last call departure checked information desk confirm flight one cancelled asked reply found aircraft hr rescheduled flight send email response twice flight never operated rescheduled think overbooked flight didnt care
2019-01-02,United Kingdom,6,verified,return journey sydney london approximately hour duration stop singapore airport faced one major issue flew economy class two year old whose inflight entertainment headphone socket working paid two year old ticket would except inflight entertainment working long flight complained cabin crew best unfortunately socket could fixed offered move seat seat available however three practical cabin crew gave first class goody including bottle champagne inconvenience caused also said could offer monitory term said would contact customer service behalf complain expect compensation crew could offer time got plane baggage claim already received email would respond within hour however could offered voucher use another flight replied declining said insult originally paid flight explained cabin crew said also said intention booking foreseeable flight airline therefore evoucher worthless alternative mean reasoning flight basic seat uncomfortable also offer wifi plane try use charge per hour economy class
2018-12-30,Thailand,5,verified,flown british airway leeds bradford london heathrow part journey back home thailand december arrived leeds bradford hour early queue check counter check process took le minute already done online check mean dropped luggage staff airport friendly helpful passed security control waited aircraft boarding process mess priority boarding flew economy boarding group luckily every passenger could board front rear door aircraft parked remote stand aircraft old cabin modern clean seat comfortable good wing view downside seat second last row back seat pitch short luckily tall problem aircraft delayed due slow boarding process weather condition crew friendly helpful captain always announce information whole flight let passenger know cause delay flight information flight departed crew started board service buy anything food option poor expensive paid credit card one hour flight expect top service standard flight arrived london heathrow time despite traffic overall flight service crew made flight enjoyable improve food boarding process better
2018-12-29,United Kingdom,3,not verified,verified gatwick tenerife aircraft either need refit need retiring medk far uncomfortable plane ever paid extra extra leg room seat always feel happier without knee chin four hour flight reckon half hour flight total lack padding seat turned flight ordeal like sitting concrete would imagine aircraft new believe leather seating quite yielding comfortable thirteen year backside compressing padding dreadful took precaution changing seat return sneaking seat pad purchased lanzarote coupled passenger next made flight little bearable staff fine outward leg little tired time returned night ten day later normally travel easyjet route occasion used avios make flight le expensive easyjet offer two trolley run flight diminishing attitude customer welfare use lengthy flight service comfort offered easyjet experience far superior
2018-12-24,United States,10,verified,booked flight expedia june denver paris via london promise could upgrade using avios booking flight trying upgrade notified could upgrade flight due purchased ticket paid early seat selection flight buy front plane notified seat changed back plane explanation found gave seat paid extra another party could request refund honor sold first place would honor refund either became ill chose refund fare plus paid upgrade
2018-12-24,South Africa,7,verified,johannesburg london bulkhead seat upper deck advantage nobody step night using configuration seat business last year time step game want keep people flying business class seat wider premium economy seat difference go full bed room put glass taking table late flight crew decided offer pre dinner drink ordered quick meal option order get sleep big mistake get appetiser tiny desert even smaller still hungry refused serve main dish reserved crew tray removed everyone else finish much getting sleep crew never came back breakfast flight total disappointment
2018-12-24,United Kingdom,1,verified,london kuala lumpur first time flying kuala lumpur dreamliner excited trip made come back fly malaysia stopping service many year paid seat first row longer leg room absolutely regretted disappointed choice made complaint crew seat sunk felt uncomfortable sitting seat next hour crew offered extra pillow seat help either screen also working watch anything whole duration flight would recommend totally avoid sitting row seat close lavatory hear toilet flusing time last time flying unless aircraft changed perhaps dreading next return flight back london crew friendly helpful fault
2018-12-23,United States,10,verified,los angeles london heathrow poor customer service checked hour prior flight departure asked aisle seat said asked replied plane place bag staff said sorry sir space put underneath seat served dinner said chicken pasta told like pasta vegetarian food said pasta vegetarian
2018-12-23,United States,2,verified,flight seattle london november canceled due technical problem waiting airport hour staying line hour associate find immediate flight offered flight would arrive london late november would take hour since purpose trip present paper conference november would missed presentation time would arrive trip supposed day time arrival return le two day advised cancel flight promised refund flight ticket well expense accommodation since late cancel booking filed claim online based instruction customer relation phone number disconnected fact automatic voice mail say please chase call website link refer tracking claim auto message link dose exist month stressful attempt connect customer relation finally responded email tell going receive refund
2018-12-22,United Kingdom,3,verified,gatwick barbados flew gatwick december back dec started well newish class lounge south terminal however walk gate mile almost mile walk joke honest north terminal flight used operate shorter walk flight decor layout much much better guess got offered cheaper deal move first impression badly new class holding scuff mark everywhere surface scratch bobble wear seat fabric probably year use look like small crack plastic wall brown stain need paint job least motley flower removed year ago save cost instated looked like pinched graveyard much said seat market business class true true class sense emirate singapore airline offer flown food also business class quality casual dining rather fine dining taking one meal start amuse bouche one motley round mozzarella bit cheese one tomato one bit green stuff one straggly piece prosciutto ham total cost outstanding prosciutto wrapped asparagus garlic aioli parmesan totally utterly boring wife soup said nice jerk chicken dish okay glassware chinaware okay cutlery poor quality stuff expect pizza express except stuff pizza express better accept stuck product next year much could improve cheap look premium product quality presentation food champagne even menu cover trumpet superb laurent perrier grand siecle champagne retail bottle nice know inferior airline class offer krug bottle alternative course ghastly ying yang club business class world hated business class sky businessman know could run airline better quality perspective price perspective bundle flight part holiday sort work okay ish fa always nice bunch men woman
2018-12-19,United Kingdom,8,verified,moscow london fantastic first class service moscow lounge surprisingly good excellent runway view quick boarding escorted seat crew new first seat fleet real upgrade older product plenty space cupboard several little storage bin addition overhead bin space inch flatscreen ife screen offered brilliant picture quality sound quality excellent thanks noise cancelling headphone dinner menu extensive food fantastic best airline meal drink constantly topped boarding arrival crew attentive friendly fantastic experience look forward next opportunity fly cabin
2018-12-19,United Kingdom,7,verified,johannesburg london supper asked warm hot water make milky drink drink tea coffee health reason given problem breakfast requested refused explained drink tea coffee milk water keep hot water get finished serving customer never came lady called take care unwell passenger kept sugar milk stirring stick asked another male cabin crew collecting tray breakfast warm water explaining waiting said bring second never came back felt like nuisance deliberately ignored couldnt bother anyone flight started bumpy preparation landing
2018-12-19,United Kingdom,1,verified,bridgetown gatwick booked return flight business club class find want charge extra choose seat awful seating ying yang seating arranged like sardine tin poor cabin staff attitude asked seat made bed told first class would everyone cabin staff almost asleep disturbed food drink passed serving hatch otherwise known privacy screen inner seat happened time sort sleep deprivation torture expecting business class level service ability sleep overnight flight sadly disappointed
2018-12-18,United Kingdom,1,verified,glasgow new york via london morning flight gla lhr really miss complimentary breakfast morning flight left time arrived plenty time make connection jfk jfk flight service fantastic meal nice offered plenty drink throughout flight left arrived time seat legroom fine mother ife work moved seat appreciated cabin crew friendly
2018-12-18,Australia,1,verified,sydney london via singapore hugely disappointed business class trip seating arrangement leave little desired isle interrupted cabin crew passing food collecting tray person sitting inside refer seat guru understanding service slow food good luck getting rid tray minute next window need extremely athletic toilet climb someone leg order get seat drink available bar could le appealing tried good luck trying get one cabin crew extremely elusive get drink careful leaving unattended pull tray two drink slip teflon type surface spill arm seat dont get started flight entertainment lack watched two movie hour flight scratching find anything else decent watch new release contradiction term little priority giving business class boarding plane sure called first plane configuration ultimately join queue board rest economy locate seat economy filing passed get seat would recommend anyone
2018-12-17,United Kingdom,4,verified,johannesburg london contrast excellent outbound experience inbound lacked wow factor cabin full dominated passenger seemed want demonstrate importance cabin crew adequate rather outstanding dinner service unremarkable cheese board shrunk size two flight ife touchscreen struggled respond finger press selection film different previous month sleep quality reasonable although high cabin temperature made duvet redundant breakfast pretty good arrival time relieved find bag made way domestic comair flight
2018-12-13,Greece,1,verified,antigua gatwick one worst business class experience entertainment system work asked crew solution reply sorry sir solution service super slow crew serve business class passenger food bad beef cooked mashed potato dry salad disgusting nobody crew help prepare bed woke min landing offered yogurt
2018-12-13,United Kingdom,6,verified,gatwick barbados first class third rate disgusting cabin crumb seat dirty carpet finger mark control looked though properly cleaned day poor service entertainment system different age avoided flying last year remember avoid route allows
2018-12-11,Canada,10,verified,cape town london unimpressive amenity service unless bulkhead seat way leave seat without either stepping someone step small storage drawer nowhere stow even small carry baggage except bin food best pedestrian wine served dinner except request took age get husband got cutlery tray get attention steward rectify gave one two set mine hand never got main course finally went asked delivered cold cooked
2018-12-11,United Kingdom,4,verified,bucharest london giving free food drink anymore pay short haul bucharest park terminal shuttle plane bus charging checked luggage ask people check hand luggage flight busy avios loyalty reward point buy lot le used problem turning budget airline least charge accordingly otherwise feel like scammed
2018-12-10,Malaysia,1,verified,kuala lumpur mexico city via london journey malaysia mexico alone business trip would boring however trip london mexico city dec quite interesting cabin crew facilitating especially associated muslim need food polite talk big smile returned back malaysia transit london mexico city dec wished able meet hope see wonderful cabin crew team next trip
2018-12-09,United Kingdom,8,verified,miami london going downhill offered chicken curry vegetable pasta outward journey choice exactly time explained steward like either choice possible salad soup another class told extremely rude steward could like lump basically said put request account account two option every time travel expect two menu snack landing disgusting bagel bun totally unacceptable attitude staff making bad situation worse light work seat read light went screen damaged watching incredibly hard entertainment travelled four time last month film barely changed travelling possible
2018-12-09,Ireland,2,verified,would like compliment british airway crew comfort flight service crew food served landing served afternoon tea plate credit catering company overall enjoyable flight london gatwick tampa
2018-12-09,United Kingdom,6,verified,arrived airport discover flight delayed several hour time clear information available check desk unable confirm delay elsewhere airport hour flight taken people purchased refreshment announcement made passenger would entitled snack airport cafe however refund provided majority already done complimentary food drink provided board make delay landed gatwick minute last train left meaning shell taxi home despite refused pay compensation delay le three hour hour minute exact took month respond request airline going downhill several year experience cement transformation overpriced easyjet fly
2018-12-07,United States,2,verified,loyal customer british airway since little girl every summer booked airline ticket company visit grandparent italy october booked airline ticket visit grandparent leaving october coming back november grandfather sick much longer live october grandfather passed away put cancellation refund request sole purpose see one last time british airway refund ticket refused refund seat even though never used service frustrating deal top loss grandfather addition every employee spoken phone probably worse customer service experience ever encountered beyond disappointed company neither family fly future
2018-12-05,United Kingdom,1,verified,gatwick la vega boarding group number seemed work well gatwick took ahead schedule service commenced min take crew seemed relaxed happy worked well team improved inflight menu show quality food one best ever long haul flight aircraft old dated ife throwback unresponsive touch screen hard watch quality used quality day enjoyable flight
2018-12-03,United Kingdom,5,not verified,verified nassau london premium economy joke highlighted friday morning breakfast glass water breakfast box containing cold sealed plastic croissant equally sealed banana bread cake hot food drink awful night battling intermittent service seat back screen screen larger economy benefit money early plane luggage prioritised collection area extra leg room seat simply uncomfortable male yes large obese premium economy forget airline better
2018-11-30,Ghana,2,verified,phoenix accra via london great customer service treatment check phoenix young lady checked professional handled check process excellently entire trip great really treated well also final leg accra staff london well want appreciate gesture professionalism staff
2018-11-30,United Kingdom,1,verified,manchester london bag drop process took hour even though checked already staff offered little apology explaining big group ahead could nothing staff flight clumsy rude one attendant dropped water bottle shoulder offered merest apology another flight attendant bother ask customer last row wanted refreshment exactly best british certainly recommending
2018-11-28,Germany,10,verified,san diego hannover via london booked com longer flight way premium economy return informed san diego american airline flight dfw severely delayed would miss flight london american airline could book later flight day coach available insisted premier economy could fly day took coach american assured would refund fare difference downgrade arrival home contacted website refund fare difference bizarre exchange followed first said buy upgraded seat told look ticket get refund economy class seat much expensive booked premium economy seat contacted germany said get refund booked travel agent charge booked website saidthey would send london compute refund get refund seat much expensive premium seat booked month advance change booking sole fault delayed american airline flight miserable customer service
2018-11-27,United Kingdom,1,verified,london heathrow stuttgart absolutely disgusted husband asked put one piece hand luggage hold due flight busy agreed one job put hold make sure arrives stuttgart proven difficult bag lost offered assistance support
2018-11-27,United Kingdom,10,verified,london johannesburg turning right first wing new experience pretty slick although guy check exactly convivial concorde room impressive particularly terrace quirky interior design overlooking main concourse boarding involved lining according group smacked bit low cost airline guess necessary passenger double decker plane first cabin definitely spacious suite also room extra storage space divider seemed higher giving better privacy fact cabin half full another bonus cabin crew friendly attentive thoroughly professional food good demonstrated airline food restaurant quality cabin crew use reheating facility properly wine offer good selection including fabulous lpgs enjoyed wine tasting sleep quality considerably better club world although cabin temperature little high overall excellent flight fully met brief first class travel
2018-11-22,United Kingdom,2,verified,booked business class paid extra seat selection boeing disappointed flight scheduled rejected offer flying belgian air change flight get different aircraft booked window seat selection lost husband forced sit separately booking told could find proof paid selected seat could prove payment booking number changed new flight spooning stranger centre isle trip planned return flight sitting apart husband work staff could nicer could find alternative seat return customer complaint offered voucher next flight despite sending two detailed message received response completely inadequate service flight attendant delivering flight paid dealing complaint
2018-11-22,Canada,1,verified,ancouver london heathrow chose fly told good family traveling month old alone needed booking process smooth stressful call customer service multiple time need improve customer service call center flight great though staff ground air helpful everything could ensure crew came around often drink food first given cot baby originally wanted one britax seat talked saying baby would comfortable cot nope big could lie straight asked switched asleep minute toilet economy order least hour reached destination everyone used business class toilet sure annoying people seated line constant
2018-11-21,United States,7,verified,boston nairobi via london good thing new clean looking plane first leg trip boston heathrow cabin crew service standard window seat twice passed offered anything eat drink everyone around simply watching movie noticed eye contact attendant offered anything airplane food exactly gourmet food bland even little ate hungry connecting flight heathrow nairobi worse plane opposite one boston heathrow looked beat lacked even basic like usb port cabin crew service leg standard probably blame overrated flying know better
2018-11-20,Switzerland,3,verified,basel san fransisco via heathrow convinced quality dropped considerably past several year booked world traveller plus premium economy cost appr twice much economy flight sfo seat wise plane reserved aisle seat food disgusting flight given box several piece junk food shortly landing given piece pizza choice food leaf lot desired cold drink offered regularly bulkhead get extra needed offered maybe two hot drink hour plane longer due delay leaving flight back worse since boeing older bulkier seat even get remote control hidden inside seat big recliner work properly general space around seat cramped person next spilled seat feel sorry larger people food bland poor barely warm drink staff seem challenged certain situation next time look alternative airline
2018-11-17,France,9,verified,london lyon flight delay flight duration ground staff forced check suitcase boarding process due lack space plane got suitcase damaged big cut back customer service useless bad experience recommend flying
2018-11-16,United States,3,verified,london boston seated next customer needed extra seat flight attendant extremely nice helpful ensured comfortable throughout flight superb customer service
2018-11-16,Sweden,2,verified,stockholm london standard configuration short haul european flight business class still seat side isle middle seat fitted tray wonderful crew super professional steward business drink served smile food also food reminding served economy year ago still free best part meal cheese pudding
2018-11-14,Netherlands,1,verified,amsterdam london arrived minute late three delay taking landing getting walkway airplane happened twice year fly klm time route delayed rarely fly british route significantly cheaper delayed sure bad luck better double flight time good day
2018-11-12,United Kingdom,9,verified,buenos aire london flew overnight friday november plane seating worn uncomfortable large number argentinian passenger plane yet saw staff spoke spanish chicken dinner described curry sauce bread roll stale dessert stodgy night water offered possible charge electronic equipment seatback screen small limited choice entertainment
2018-11-10,Saudi Arabia,2,verified,business class space ridiculously narrow service careless allowed laptop flight riyadh cannot work want cannot choose eat
2018-11-06,United Kingdom,7,verified,aberdeen heathrow connect flight gatwick day check using app problem start opened noted boarding pas issued allowing add bag hold calling explaining situation told option pay airport desk rip short flight curiosity checked easyjet booked day would cost fly money asked bag
2018-11-05,Australia,1,verified,would recommend airline travel lot work get fly different airline good base compare baggage allowance give kg checked baggage regardless bag travel companion pay aud extra strictest airline ever used airline allowed kg charge ensure pre weighed bag flight meal way sydney served soggy squashed sandwich meal hour flight make sure pack snack meal get bottle water rarely serve drink make sure pre pack bottle two custom customer service get customer service appalling hard enough traveling kid deal stressful allow swap ticket husband traveling kid slight delay meant flight airport find child booking caused delay stress misplace kid booking put husband seat anything help change ask person next kid plane bother flying
2018-11-04,Hungary,4,verified,new york budapest via london second flight bit different plane clean cold wanted drink water cabin crew accepted request mistake captain welcomed passenger bucharest budapest
2018-11-02,United Kingdom,1,verified,heathrow athens arrived airport time bag drop ease got gate within min bag drop light security queue aircraft sufficient seat legroom seat funny safety video played flight smooth food served except bbc news playing screen sound russian caption quite confusing plane landed half hour late best landing ever experienced
